author,title,publication_date,link,document_id,document_length,link_OCR
"Boissin de Gallardon, Jean",Les tragédies et histoires saintes de Jean Boissin de Gallardon,1618,http://catalogue.bnf.fr/ark:/12148/cb30122385g,bpt6k5745752g,338338,https://github.com/TextEnt/chrono-spatial-processing/blob/main/data/corpus_normalized/bpt6k5745752g.txt
"Hauteroche, Noël Lebreton",Les bourgeoises de qualité . Comedie. Par Mr de Haute Roche,1691,http://catalogue.bnf.fr/ark:/12148/cb30582284s,bpt6k5752605t,103493,https://github.com/TextEnt/chrono-spatial-processing/blob/main/data/corpus_normalized/bpt6k5752605t.txt
,Le Mariage de Fine-Epice. Comédie,1664,http://catalogue.bnf.fr/ark:/12148/cb39325270g,bpt6k852919x,134035,https://github.com/TextEnt/chrono-spatial-processing/blob/main/data/corpus_normalized/bpt6k852919x.txt
Molière,"Sganarelle ou le Cocu imaginaire, comédie avec les arguments de chaque scène",1662,http://catalogue.bnf.fr/ark:/12148/cb38650865b,bpt6k12804007,67710,https://github.com/TextEnt/chrono-spatial-processing/blob/main/data/corpus_normalized/bpt6k12804007.txt
"Corneille, Thomas","Ariane , tragédie. Par T. Corneille",1672,http://catalogue.bnf.fr/ark:/12148/cb30272162g,bpt6k5772310n,76240,https://github.com/TextEnt/chrono-spatial-processing/blob/main/data/corpus_normalized/bpt6k5772310n.txt
"La Calprenède, Gautier de Coste",Phalante : tragédie / de Mr de La Calprenède,1642,http://catalogue.bnf.fr/ark:/12148/cb30706516s,bpt6k1097720,82353,https://github.com/TextEnt/chrono-spatial-processing/blob/main/data/corpus_normalized/bpt6k1097720.txt
"Discret, L","Alizon, comédie Desdiée au jeunes veufves & aux vieilles filles",1637,http://catalogue.bnf.fr/ark:/12148/cb30344267h,bpt6k58122453,97150,https://github.com/TextEnt/chrono-spatial-processing/blob/main/data/corpus_normalized/bpt6k58122453.txt
"Boyer, Claude","Le Comte d'Essex, tragédie",1678,http://catalogue.bnf.fr/ark:/12148/cb44729657f,bpt6k1090222x,82446,https://github.com/TextEnt/chrono-spatial-processing/blob/main/data/corpus_normalized/bpt6k1090222x.txt
"Behourt, Jean","Hypsicratee, ou La magnanimite tragoedie nouvellement représentee, au college des Bons Enfans",1604,http://catalogue.bnf.fr/ark:/12148/cb30077767q,bpt6k8568902,107857,https://github.com/TextEnt/chrono-spatial-processing/blob/main/data/corpus_normalized/bpt6k8568902.txt
"Rotrou, Jean de","La Célimène , comédie de Rotrou. Accomodée au théâtre, sous le titre d'Amarillis, pastorale",1653,http://catalogue.bnf.fr/ark:/12148/cb31251862w,bpt6k5734490j,79660,https://github.com/TextEnt/chrono-spatial-processing/blob/main/data/corpus_normalized/bpt6k5734490j.txt
"Mareschal, André","Le Railleur, ou La satyre du temps , comédie",1638,http://catalogue.bnf.fr/ark:/12148/cb30881262r,bpt6k6255892m,98946,https://github.com/TextEnt/chrono-spatial-processing/blob/main/data/corpus_normalized/bpt6k6255892m.txt
Molière,"La Critique de l'Escole des femmes, comédie par J. B. P. Molière",1674,http://catalogue.bnf.fr/ark:/12148/cb38650917r,bpt6k1280445t,49680,https://github.com/TextEnt/chrono-spatial-processing/blob/main/data/corpus_normalized/bpt6k1280445t.txt
"Rotrou, Jean de","La pelerine amoureuse, tragi-comedie de Rotrou.",1637,http://catalogue.bnf.fr/ark:/12148/cb31251841x,btv1b8622111v,89644,https://github.com/TextEnt/chrono-spatial-processing/blob/main/data/corpus_normalized/btv1b8622111v.txt
"Boisrobert, François de","Théodore, Reyne de Hongrie, tragi-comédie",1658,http://catalogue.bnf.fr/ark:/12148/cb44729598r,bpt6k10901623,80779,https://github.com/TextEnt/chrono-spatial-processing/blob/main/data/corpus_normalized/bpt6k10901623.txt
Montfleury,La femme juge et partie . Comedie. Par A. J. Montfleury,1669,http://catalogue.bnf.fr/ark:/12148/cb30971162f,btv1b86221039,85767,https://github.com/TextEnt/chrono-spatial-processing/blob/main/data/corpus_normalized/btv1b86221039.txt
"Du Peschier, Nicolas","La Comédie des comédies, traduite d'italien en langage de l'Orateur François",1629,http://catalogue.bnf.fr/ark:/12148/cb447294974,bpt6k1090061b,102764,https://github.com/TextEnt/chrono-spatial-processing/blob/main/data/corpus_normalized/bpt6k1090061b.txt
Molière,"Le Sicilien, ou L'amour peintre, comedie. Par J. B. P. de Moliere",1668,http://catalogue.bnf.fr/ark:/12148/cb309589320,bpt6k12804645,35068,https://github.com/TextEnt/chrono-spatial-processing/blob/main/data/corpus_normalized/bpt6k12804645.txt
"Vion, Charles de","La Pompe funèbre, ou Damon et Cloris, pastorale ; suivi de La Réforme du Royaume d'Amour",1634,http://catalogue.bnf.fr/ark:/12148/cb44729486g,bpt6k1090049w,143357,https://github.com/TextEnt/chrono-spatial-processing/blob/main/data/corpus_normalized/bpt6k1090049w.txt
"Rotrou, Jean de",Clorinde : comédie/de Rotrou,1637,http://catalogue.bnf.fr/ark:/12148/cb32586844f,btv1b8622099v,87528,https://github.com/TextEnt/chrono-spatial-processing/blob/main/data/corpus_normalized/btv1b8622099v.txt
Lambert,"Les Sœurs jalouses, ou l'Escharpe et le Brasselet, comédie",1661,http://catalogue.bnf.fr/ark:/12148/cb44729532t,bpt6k10900954,91635,https://github.com/TextEnt/chrono-spatial-processing/blob/main/data/corpus_normalized/bpt6k10900954.txt
"Scarron, Paul","Le Prince corsaire, tragi-comédie",1663,http://catalogue.bnf.fr/ark:/12148/cb44729577s,bpt6k1090142b,79524,https://github.com/TextEnt/chrono-spatial-processing/blob/main/data/corpus_normalized/bpt6k1090142b.txt
Molière,"L'Escole des femmes, comédie par J. B. P. Molière",1674,http://catalogue.bnf.fr/ark:/12148/cb38650901c,bpt6k1280452z,93676,https://github.com/TextEnt/chrono-spatial-processing/blob/main/data/corpus_normalized/bpt6k1280452z.txt
"Rotrou, Jean de","La Bague de l'oubly, comédie",1654,http://catalogue.bnf.fr/ark:/12148/cb44729709v,bpt6k1090276g,78599,https://github.com/TextEnt/chrono-spatial-processing/blob/main/data/corpus_normalized/bpt6k1090276g.txt
"Campistron, Jean Galbert de","Alcide, tragédie en musique (paroles de Campistron, musique de Lulli et Marais), représentée par l'Académie royalle de musique",1693,http://catalogue.bnf.fr/ark:/12148/cb301905970,bpt6k5629556w,34273,https://github.com/TextEnt/chrono-spatial-processing/blob/main/data/corpus_normalized/bpt6k5629556w.txt
"Bigres de Jussy, Pierre-Louis",Adolphe ou Le bigame genereux . Tragi-comedie.,1650,http://catalogue.bnf.fr/ark:/12148/cb38652614c,bpt6k857183z,110119,https://github.com/TextEnt/chrono-spatial-processing/blob/main/data/corpus_normalized/bpt6k857183z.txt
"Tasse, Le","L'Aminte,... pastorale fidellement traduite de l'italien en vers françois [par Vion Dalibray]...",1632,http://catalogue.bnf.fr/ark:/12148/cb386931591,bpt6k12801807,121664,https://github.com/TextEnt/chrono-spatial-processing/blob/main/data/corpus_normalized/bpt6k12801807.txt
"Rotrou, Jean de","Les Ménechmes, comédie",1661,http://catalogue.bnf.fr/ark:/12148/cb44729606j,bpt6k1090170n,85299,https://github.com/TextEnt/chrono-spatial-processing/blob/main/data/corpus_normalized/bpt6k1090170n.txt
"Boyer, Claude","Le Fils supposé, tragédie",1672,http://catalogue.bnf.fr/ark:/12148/cb447295664,bpt6k1090131j,88264,https://github.com/TextEnt/chrono-spatial-processing/blob/main/data/corpus_normalized/bpt6k1090131j.txt
"Mareschal, André",Le Dictateur romain : tragédie dédiée à Mgr le duc d'Espernon / [A. Mareschal],1647,http://catalogue.bnf.fr/ark:/12148/cb35285434p,bpt6k63412802,86912,https://github.com/TextEnt/chrono-spatial-processing/blob/main/data/corpus_normalized/bpt6k63412802.txt
"Rayssiguier, De",Alidor et Oronte. Tragi-comedie du sieur de R.,1636,http://catalogue.bnf.fr/ark:/12148/cb38768451v,bpt6k1513096g,75453,https://github.com/TextEnt/chrono-spatial-processing/blob/main/data/corpus_normalized/bpt6k1513096g.txt
"Regnard, Jean-François",Attendez-moy sous l'orme . Comedie,1694,http://catalogue.bnf.fr/ark:/12148/cb35944667b,bpt6k61486960,32550,https://github.com/TextEnt/chrono-spatial-processing/blob/main/data/corpus_normalized/bpt6k61486960.txt
,"Dialogue du cardinal de Richelieu voulant entrer en Paradis, et sa descente aux enfers . Tragi-comédie",1643,http://catalogue.bnf.fr/ark:/12148/cb333458801,bpt6k5651559g,16812,https://github.com/TextEnt/chrono-spatial-processing/blob/main/data/corpus_normalized/bpt6k5651559g.txt
"Rotrou, Jean de","Les Sosies, comédie",1668,http://catalogue.bnf.fr/ark:/12148/cb44729591b,bpt6k1090155z,91197,https://github.com/TextEnt/chrono-spatial-processing/blob/main/data/corpus_normalized/bpt6k1090155z.txt
"Félibien, André",Relation de la feste de Versailles. Du dix-huitiéme juillet mil six cens soixante-huit / [par A. Félibien],1668,http://catalogue.bnf.fr/ark:/12148/cb33579002z,bpt6k1526235p,61717,https://github.com/TextEnt/chrono-spatial-processing/blob/main/data/corpus_normalized/bpt6k1526235p.txt
"Prévost, Jean","Les Secondes Œuvres poetiques et tragiques de Jeahn Prevost [...], Imprimees nouvelement",1613,http://catalogue.bnf.fr/ark:/12148/cb447297044,bpt6k1090271d,207358,https://github.com/TextEnt/chrono-spatial-processing/blob/main/data/corpus_normalized/bpt6k1090271d.txt
"Lavalise, De",La farce des courtisans de Pluton et leur pèlerinage en son royaume,1649,http://catalogue.bnf.fr/ark:/12148/cb30753852s,bpt6k5849655v,34819,https://github.com/TextEnt/chrono-spatial-processing/blob/main/data/corpus_normalized/bpt6k5849655v.txt
"Rosimond, Claude Rose","La Dupe amoureuse, comédie",1671,http://catalogue.bnf.fr/ark:/12148/cb44729568t,bpt6k1090133c,34291,https://github.com/TextEnt/chrono-spatial-processing/blob/main/data/corpus_normalized/bpt6k1090133c.txt
,"Le martyre de sainte Reyne d'Alise , tragedie. Composée par un religieux de l'abbaye de Flavigny, où repose le corps de sainte Reine. Premiere edition",1687,http://catalogue.bnf.fr/ark:/12148/cb39333929p,btv1b8614585w,66999,https://github.com/TextEnt/chrono-spatial-processing/blob/main/data/corpus_normalized/btv1b8614585w.txt
"Chevreau, Urbain",L'Innocent exilé . Tragi-comédie,1640,http://catalogue.bnf.fr/ark:/12148/cb30236833z,bpt6k61251657,97164,https://github.com/TextEnt/chrono-spatial-processing/blob/main/data/corpus_normalized/bpt6k61251657.txt
"Rotrou, Jean de",La Diane comédie . Par le Sieur Rotrou. Dédiée à Monsieur le comte de Fiesque,1635,http://catalogue.bnf.fr/ark:/12148/cb31251882h,btv1b86221269,100960,https://github.com/TextEnt/chrono-spatial-processing/blob/main/data/corpus_normalized/btv1b86221269.txt
"Genest, Charles-Claude","Zelonide, princesse de Sparte . Tragedie",1682,http://catalogue.bnf.fr/ark:/12148/cb30494969b,bpt6k9807756q,79661,https://github.com/TextEnt/chrono-spatial-processing/blob/main/data/corpus_normalized/bpt6k9807756q.txt
"Hardy, Alexandre","Les chastes et loyales amours de Théagène et Cariclée , réduites du grec de l'Histoire d'Héliodore en huict poèmes dragmatiques ou théâtres consécutifs, par Alexandre Hardy, Parisien",1623,http://catalogue.bnf.fr/ark:/12148/cb30589051z,bpt6k63635719,541424,https://github.com/TextEnt/chrono-spatial-processing/blob/main/data/corpus_normalized/bpt6k63635719.txt
"Chevalier, Jean",La disgrâce des domestiques : comédie représentée sur le théâtre royal du Marais / [par J. Chevalier],1662,http://catalogue.bnf.fr/ark:/12148/cb302353351,bpt6k1519298v,26540,https://github.com/TextEnt/chrono-spatial-processing/blob/main/data/corpus_normalized/bpt6k1519298v.txt
Néel,"L'illusion grotesque ou le point nécromancien, comédie / par M. Néel...",1678,http://catalogue.bnf.fr/ark:/12148/cb387666121,bpt6k852913n,39981,https://github.com/TextEnt/chrono-spatial-processing/blob/main/data/corpus_normalized/bpt6k852913n.txt
"Scudéry, Georges de","L'Amour tirannique, tragédie-comédie, par M. de Scudéry",1639,http://catalogue.bnf.fr/ark:/12148/cb31341723p,btv1b8607044w,160764,https://github.com/TextEnt/chrono-spatial-processing/blob/main/data/corpus_normalized/btv1b8607044w.txt
"Corneille, Pierre","Cinna, ou la Clémence d'Auguste, tragédie (par P. Corneille)...",1646,http://catalogue.bnf.fr/ark:/12148/cb30271545r,bpt6k1280290z,101620,https://github.com/TextEnt/chrono-spatial-processing/blob/main/data/corpus_normalized/bpt6k1280290z.txt
Molière,"Les Festes de l'Amour et de Bacchus, pastorale [Divertissements des Amants magnifiques, de George Dandin et Pastorale comique, de Molière, arrangés par Quinault et Lully] précédée de la Grotte de Versailles, représentées à l'Académie royale de musique",1696,http://catalogue.bnf.fr/ark:/12148/cb30958633h,bpt6k15163632,28715,https://github.com/TextEnt/chrono-spatial-processing/blob/main/data/corpus_normalized/bpt6k15163632.txt
"Colonia, Dominique de","Germanicus, tragédie",1693,http://catalogue.bnf.fr/ark:/12148/cb44729547v,bpt6k10901126,58995,https://github.com/TextEnt/chrono-spatial-processing/blob/main/data/corpus_normalized/bpt6k10901126.txt
"Romain, Nicolas","Maurice tragoedie. Dediée à tres-haut, & tres-genereux prince monseigneur de Vaudemont François de Lorraine. Par Nicolas Romain docteur és droicts, conseiller de mondict seigneur, capitaine, prevost, & gruyer du Pont-à-Mousson",1606,http://catalogue.bnf.fr/ark:/12148/cb38769005t,bpt6k8569793,145985,https://github.com/TextEnt/chrono-spatial-processing/blob/main/data/corpus_normalized/bpt6k8569793.txt
"Millet, Jean",Pastorale et tragi-comedie de Janin,1692,http://catalogue.bnf.fr/ark:/12148/cb44729496s,bpt6k1090060x,141687,https://github.com/TextEnt/chrono-spatial-processing/blob/main/data/corpus_normalized/bpt6k1090060x.txt
"Puget de La Serre, Jean","Le Pyrame, tragédie en prose",1633,http://catalogue.bnf.fr/ark:/12148/cb447294854,bpt6k1090048g,73267,https://github.com/TextEnt/chrono-spatial-processing/blob/main/data/corpus_normalized/bpt6k1090048g.txt
,"La Cocue imaginaire, comedie",1662,http://catalogue.bnf.fr/ark:/12148/cb44729574r,bpt6k1090139v,42313,https://github.com/TextEnt/chrono-spatial-processing/blob/main/data/corpus_normalized/bpt6k1090139v.txt
Molière,Le grand divertissement royal de Versailles,1668,http://catalogue.bnf.fr/ark:/12148/cb30958657h,bpt6k1526239b,11922,https://github.com/TextEnt/chrono-spatial-processing/blob/main/data/corpus_normalized/bpt6k1526239b.txt
"Rosimond, Claude Rose","Les Qui pro quo, ou le Valet etourdy, comédie",1673,http://catalogue.bnf.fr/ark:/12148/cb447296652,bpt6k1090230g,57297,https://github.com/TextEnt/chrono-spatial-processing/blob/main/data/corpus_normalized/bpt6k1090230g.txt
"Rotrou, Jean de","L'hypocondriaque, ou Le mort amoureux , tragi-comédie.Dédiée a monseigneur le comte de Soissons. Par le Sr Rotrou.",1631,http://catalogue.bnf.fr/ark:/12148/cb312518966,bpt6k5828916x,115455,https://github.com/TextEnt/chrono-spatial-processing/blob/main/data/corpus_normalized/bpt6k5828916x.txt
"Chevalier, Jean","Les Galans ridicules ou les Amours de Guillot et de Ragotin, comédie...",1662,http://catalogue.bnf.fr/ark:/12148/cb393251330,bpt6k1519300g,24573,https://github.com/TextEnt/chrono-spatial-processing/blob/main/data/corpus_normalized/bpt6k1519300g.txt
"Racine, Jean","Athalie , tragédie tirée de l'Écriture sainte [de J. Racine]",1691,http://catalogue.bnf.fr/ark:/12148/cb31169029t,bpt6k15107128,97370,https://github.com/TextEnt/chrono-spatial-processing/blob/main/data/corpus_normalized/bpt6k15107128.txt
Molière,"L'avare , comédie par J.-B. P. Molière",1669,http://catalogue.bnf.fr/ark:/12148/cb309583988,btv1b8610783h,120477,https://github.com/TextEnt/chrono-spatial-processing/blob/main/data/corpus_normalized/btv1b8610783h.txt
Baussays,"La Cydippe de Monsieur le Chevalier de Baussays, pastorale",1632,http://catalogue.bnf.fr/ark:/12148/cb38652182g,bpt6k853059s,104287,https://github.com/TextEnt/chrono-spatial-processing/blob/main/data/corpus_normalized/bpt6k853059s.txt
"Passerat, François","L'heureux accident ou la maison de campagne, comédie / par M. Passerat",1695,http://catalogue.bnf.fr/ark:/12148/cb38767264d,bpt6k852855g,55373,https://github.com/TextEnt/chrono-spatial-processing/blob/main/data/corpus_normalized/bpt6k852855g.txt
